{
  "schema_version": 1,
  "dataset_id": "level_exit_evidence_bundles",
  "version": 1,
  "source_dispositions": {
    "path": "data/reviewed/source-dispositions-v1.json",
    "sha256": "15824d8281d9e6669eddc40780e3f9ab3113866834c7fae997b2de76bf92a32d",
    "record_count": 9274
  },
  "bundles": [
    {
      "bundle_id": "cefr_all_descriptors.a1.communication_strategy",
      "selector": {
        "source_dataset_id": "cefr_all_descriptors",
        "source_level_code": "a1",
        "strand_code": "communication_strategy"
      },
      "evidence_role": "primary_level_boundary",
      "matched_record_count": 3,
      "matched_record_ids_sha256": "d0f2e06d14d352c4e80ed4dd35b477efa7df9b776d252a6c860e8a12733b9a6b",
      "representative_record_ids": [
        "cefr.cv2020.p069.a1.compensating.001",
        "cefr.cv2020.p089.a1.asking_for_clarification.001",
        "cefr.cv2020.p089.a1.asking_for_clarification.002"
      ]
    },
    {
      "bundle_id": "cefr_all_descriptors.a1.discourse",
      "selector": {
        "source_dataset_id": "cefr_all_descriptors",
        "source_level_code": "a1",
        "strand_code": "discourse"
      },
      "evidence_role": "primary_level_boundary",
      "matched_record_count": 2,
      "matched_record_ids_sha256": "2196c78d16a31b061c01b257489b7c61c3ee53b9e13b952132dfc67cf2b2caf3",
      "representative_record_ids": [
        "cefr.cv2020.p141.a1.coherence_and_cohesion.001",
        "cefr.cv2020.p142.a1.propositional_precision.001"
      ]
    },
    {
      "bundle_id": "cefr_all_descriptors.a1.fluency",
      "selector": {
        "source_dataset_id": "cefr_all_descriptors",
        "source_level_code": "a1",
        "strand_code": "fluency"
      },
      "evidence_role": "primary_level_boundary",
      "matched_record_count": 1,
      "matched_record_ids_sha256": "6f007efa8f483c8ada1e154e84885a2f5e95ff75c3f63db24d531b401dbece31",
      "representative_record_ids": [
        "cefr.cv2020.p142.a1.fluency.001"
      ]
    },
    {
      "bundle_id": "cefr_all_descriptors.a1.grammar",
      "selector": {
        "source_dataset_id": "cefr_all_descriptors",
        "source_level_code": "a1",
        "strand_code": "grammar"
      },
      "evidence_role": "primary_level_boundary",
      "matched_record_count": 1,
      "matched_record_ids_sha256": "90271b880fbfb118d5debc4b1f7c23c45889fb7ebb18cfdf50b58fec6313b012",
      "representative_record_ids": [
        "cefr.cv2020.p132.a1.grammatical_accuracy.001"
      ]
    },
    {
      "bundle_id": "cefr_all_descriptors.a1.language_range",
      "selector": {
        "source_dataset_id": "cefr_all_descriptors",
        "source_level_code": "a1",
        "strand_code": "language_range"
      },
      "evidence_role": "primary_level_boundary",
      "matched_record_count": 2,
      "matched_record_ids_sha256": "2432e00ba273416a147346a43abd5ce94ddcb16965f79beff590b54bad5cf8e8",
      "representative_record_ids": [
        "cefr.cv2020.p131.a1.general_linguistic_range.001",
        "cefr.cv2020.p131.a1.general_linguistic_range.002"
      ]
    },
    {
      "bundle_id": "cefr_all_descriptors.a1.listening_reception",
      "selector": {
        "source_dataset_id": "cefr_all_descriptors",
        "source_level_code": "a1",
        "strand_code": "listening_reception"
      },
      "evidence_role": "primary_level_boundary",
      "matched_record_count": 10,
      "matched_record_ids_sha256": "2fa1f0fb6c538381ada5f63d1e82897d8fe618b228420a3e2899365f69de8cd5",
      "representative_record_ids": [
        "cefr.cv2020.p048.a1.overall_oral_comprehension.001",
        "cefr.cv2020.p051.a1.understanding_announcements_and_instructions.002",
        "cefr.cv2020.p053.a1.watching_tv_film_and_video.001"
      ]
    },
    {
      "bundle_id": "cefr_all_descriptors.a1.mediation",
      "selector": {
        "source_dataset_id": "cefr_all_descriptors",
        "source_level_code": "a1",
        "strand_code": "mediation"
      },
      "evidence_role": "primary_level_boundary",
      "matched_record_count": 18,
      "matched_record_ids_sha256": "494d04c034edcd29f4fa71400c8bcc97723f75ac830782a2749d7a57bdc0e906",
      "representative_record_ids": [
        "cefr.cv2020.p092.a1.overall_mediation.001",
        "cefr.cv2020.p111.a1.collaborating_to_construct_meaning.001",
        "cefr.cv2020.p128.a1.building_on_plurilingual_repertoire.001"
      ]
    },
    {
      "bundle_id": "cefr_all_descriptors.a1.oral_interaction",
      "selector": {
        "source_dataset_id": "cefr_all_descriptors",
        "source_level_code": "a1",
        "strand_code": "oral_interaction"
      },
      "evidence_role": "primary_level_boundary",
      "matched_record_count": 22,
      "matched_record_ids_sha256": "5c127579a1ff420f97b30fb4bf8a58458f03f95908244c230d68d73321bdc0a1",
      "representative_record_ids": [
        "cefr.cv2020.p072.a1.overall_oral_interaction.001",
        "cefr.cv2020.p078.a1.obtaining_goods_and_services.001",
        "cefr.cv2020.p080.a1.interviewing_and_being_interviewed.002"
      ]
    },
    {
      "bundle_id": "cefr_all_descriptors.a1.pronunciation",
      "selector": {
        "source_dataset_id": "cefr_all_descriptors",
        "source_level_code": "a1",
        "strand_code": "pronunciation"
      },
      "evidence_role": "primary_level_boundary",
      "matched_record_count": 4,
      "matched_record_ids_sha256": "3bd14b1c1ecc9070e44d20be4a228e1c3dc914572af825b275fc4aede83f9d29",
      "representative_record_ids": [
        "cefr.cv2020.p135.a1.overall_phonological_control.001",
        "cefr.cv2020.p135.a1.sound_articulation.001",
        "cefr.cv2020.p135.a1.sound_articulation.002"
      ]
    },
    {
      "bundle_id": "cefr_all_descriptors.a1.reading_reception",
      "selector": {
        "source_dataset_id": "cefr_all_descriptors",
        "source_level_code": "a1",
        "strand_code": "reading_reception"
      },
      "evidence_role": "primary_level_boundary",
      "matched_record_count": 14,
      "matched_record_ids_sha256": "7c75491d0a22d9165baba1c7f18f71cbc1180c4a3cce0407eb27dc3f64d67fca",
      "representative_record_ids": [
        "cefr.cv2020.p054.a1.overall_reading_comprehension.001",
        "cefr.cv2020.p057.a1.reading_for_information_and_argument.001",
        "cefr.cv2020.p060.a1.identifying_cues_and_inferring_spoken_signed_and.002"
      ]
    },
    {
      "bundle_id": "cefr_all_descriptors.a1.sociolinguistic",
      "selector": {
        "source_dataset_id": "cefr_all_descriptors",
        "source_level_code": "a1",
        "strand_code": "sociolinguistic"
      },
      "evidence_role": "primary_level_boundary",
      "matched_record_count": 1,
      "matched_record_ids_sha256": "e81ad76cc18ca6d60339a491ff140c9751135f64f1d756f8f124ec903965dd17",
      "representative_record_ids": [
        "cefr.cv2020.p137.a1.sociolinguistic_appropriateness.001"
      ]
    },
    {
      "bundle_id": "cefr_all_descriptors.a1.speaking_production",
      "selector": {
        "source_dataset_id": "cefr_all_descriptors",
        "source_level_code": "a1",
        "strand_code": "speaking_production"
      },
      "evidence_role": "primary_level_boundary",
      "matched_record_count": 5,
      "matched_record_ids_sha256": "725f4aca63d3e16257e4d6c72318d94c84b9396cdc1afee899ffc20b0269409c",
      "representative_record_ids": [
        "cefr.cv2020.p062.a1.overall_oral_production.001",
        "cefr.cv2020.p063.a1.sustained_monologue_describing_experience.002",
        "cefr.cv2020.p066.a1.addressing_audiences.001"
      ]
    },
    {
      "bundle_id": "cefr_all_descriptors.a1.vocabulary",
      "selector": {
        "source_dataset_id": "cefr_all_descriptors",
        "source_level_code": "a1",
        "strand_code": "vocabulary"
      },
      "evidence_role": "primary_level_boundary",
      "matched_record_count": 1,
      "matched_record_ids_sha256": "a7384d10d3ac265dca357300e3be5ee4c245af14cb944646e09475d80f450a6d",
      "representative_record_ids": [
        "cefr.cv2020.p131.a1.vocabulary_range.001"
      ]
    },
    {
      "bundle_id": "cefr_all_descriptors.a1.writing_production",
      "selector": {
        "source_dataset_id": "cefr_all_descriptors",
        "source_level_code": "a1",
        "strand_code": "writing_production"
      },
      "evidence_role": "primary_level_boundary",
      "matched_record_count": 8,
      "matched_record_ids_sha256": "5f9a937ab100087c2254f499b32264e678f588b59f14178e90d07dcd963cfc92",
      "representative_record_ids": [
        "cefr.cv2020.p066.a1.overall_written_production.001",
        "cefr.cv2020.p067.a1.creative_writing.003",
        "cefr.cv2020.p136.a1.orthographic_control.003"
      ]
    },
    {
      "bundle_id": "cefr_all_descriptors.a1.written_online_interaction",
      "selector": {
        "source_dataset_id": "cefr_all_descriptors",
        "source_level_code": "a1",
        "strand_code": "written_online_interaction"
      },
      "evidence_role": "primary_level_boundary",
      "matched_record_count": 9,
      "matched_record_ids_sha256": "95b6fe7e1e88d7c6ff12b8078842a79a77b697991a9b2eaf8f1d6332ea192bc2",
      "representative_record_ids": [
        "cefr.cv2020.p082.a1.overall_written_interaction.001",
        "cefr.cv2020.p084.a1.notes_messages_and_forms.001",
        "cefr.cv2020.p087.a1.goal_oriented_online_transactions_and_collaboration.001"
      ]
    },
    {
      "bundle_id": "cefr_all_descriptors.a2.communication_strategy",
      "selector": {
        "source_dataset_id": "cefr_all_descriptors",
        "source_level_code": "a2",
        "strand_code": "communication_strategy"
      },
      "evidence_role": "primary_level_boundary",
      "matched_record_count": 14,
      "matched_record_ids_sha256": "c6cb2c8d7353eb086dbead1b67577a8b6f5826be16dffd6114655e4f26c99d02",
      "representative_record_ids": [
        "cefr.cv2020.p069.a2.compensating.001",
        "cefr.cv2020.p089.a2.asking_for_clarification.002",